{
  "schemaVersion": "4.4.0",
  "waVersion": "2.3000.1047483476",
  "collections": [
    "regular",
    "regular_low",
    "regular_high",
    "critical_block",
    "critical_unblock_low"
  ],
  "actions": {
    "AdsCtwaPerCustomerDataSharing": {
      "module": "WAWebCtwaPerCustomerDataSharingSync",
      "name": "ctwaPerCustomerDataSharing",
      "collection": "regular_high",
      "version": 1,
      "scope": "account",
      "baseClass": "AccountSyncdActionBase",
      "valueField": "ctwaPerCustomerDataSharingAction",
      "valueProtoType": "SyncActionValue.CtwaPerCustomerDataSharingAction",
      "valueEnumFields": null,
      "chatJidIndex": null,
      "indexParts": [
        {
          "type": "literal",
          "value": "ctwaPerCustomerDataSharing"
        },
        {
          "type": "string",
          "name": "accountLid"
        }
      ]
    },
    "Agent": {
      "module": "WAWebAgentSync",
      "name": "deviceAgent",
      "collection": "regular",
      "version": 7,
      "scope": "account",
      "baseClass": "AccountSyncdActionBase",
      "valueField": "agentAction",
      "valueProtoType": "SyncActionValue.AgentAction",
      "valueEnumFields": null,
      "chatJidIndex": null,
      "indexParts": [
        {
          "type": "literal",
          "value": "deviceAgent"
        },
        {
          "type": "string",
          "name": "agentId"
        }
      ]
    },
    "AiThreadDelete": {
      "module": "WAWebAiThreadDeleteSync",
      "name": "ai_thread_delete",
      "collection": "regular_high",
      "version": 7,
      "scope": "chat",
      "baseClass": "ChatSyncdActionBase",
      "valueField": null,
      "valueProtoType": null,
      "valueEnumFields": null,
      "chatJidIndex": 1,
      "indexParts": [
        {
          "type": "literal",
          "value": "ai_thread_delete"
        },
        {
          "type": "jid",
          "name": "chatJid"
        },
        {
          "type": "string",
          "name": "id"
        }
      ]
    },
    "AiThreadPin": {
      "module": "WAWebAiThreadPinSync",
      "name": "thread_pin",
      "collection": "regular_low",
      "version": 7,
      "scope": "chat",
      "baseClass": "ChatSyncdActionBase",
      "valueField": "threadPinAction",
      "valueProtoType": "SyncActionValue.ThreadPinAction",
      "valueEnumFields": null,
      "chatJidIndex": 1,
      "indexParts": [
        {
          "type": "literal",
          "value": "thread_pin"
        },
        {
          "type": "jid",
          "name": "chatJid"
        },
        {
          "type": "string",
          "name": "id"
        }
      ]
    },
    "AiThreadRename": {
      "module": "WAWebAiThreadRenameSync",
      "name": "ai_thread_rename",
      "collection": "regular_low",
      "version": 7,
      "scope": "chat",
      "baseClass": "ChatSyncdActionBase",
      "valueField": "aiThreadRenameAction",
      "valueProtoType": "SyncActionValue.AiThreadRenameAction",
      "valueEnumFields": null,
      "chatJidIndex": 1,
      "indexParts": [
        {
          "type": "literal",
          "value": "ai_thread_rename"
        },
        {
          "type": "jid",
          "name": "chatJid"
        },
        {
          "type": "string",
          "name": "id"
        }
      ]
    },
    "AndroidUnsupportedActions": {
      "module": "WAWebAndroidUnsupportedActionsSync",
      "name": "android_unsupported_actions",
      "collection": "regular_low",
      "version": 4,
      "scope": "account",
      "baseClass": "AccountSyncdActionBase",
      "valueField": "androidUnsupportedActions",
      "valueProtoType": "SyncActionValue.AndroidUnsupportedActions",
      "valueEnumFields": null,
      "chatJidIndex": null,
      "indexParts": [
        {
          "type": "literal",
          "value": "android_unsupported_actions"
        }
      ]
    },
    "Archive": {
      "module": "WAWebArchiveChatSync",
      "name": "archive",
      "collection": "regular_low",
      "version": 3,
      "scope": "chatMessageRange",
      "baseClass": "ChatMessageRangeSyncdActionBase",
      "valueField": "archiveChatAction",
      "valueProtoType": "SyncActionValue.ArchiveChatAction",
      "valueEnumFields": null,
      "chatJidIndex": 1,
      "indexParts": [
        {
          "type": "literal",
          "value": "archive"
        },
        {
          "type": "jid",
          "name": "chatJid"
        }
      ]
    },
    "AvatarUpdated": {
      "module": "WAWebStickersAvatarUpdatedSyncAction",
      "name": "avatar_updated_action",
      "collection": "regular",
      "version": 7,
      "scope": "account",
      "baseClass": "AccountSyncdActionBase",
      "valueField": null,
      "valueProtoType": null,
      "valueEnumFields": null,
      "chatJidIndex": null,
      "indexParts": [
        {
          "type": "literal",
          "value": "avatar_updated_action"
        }
      ]
    },
    "BizAiSettingsNudge": {
      "module": "WAWebBizAiSettingsNudgeSync",
      "name": "biz_ai_settings_nudge",
      "collection": "regular_high",
      "version": 1,
      "scope": "account",
      "baseClass": "AccountSyncdActionBase",
      "valueField": "bizAiSettingsNudgeAction",
      "valueProtoType": "SyncActionValue.BizAISettingsNudgeAction",
      "valueEnumFields": {
        "category": "BizAISettingsNudgeAction.BizAISettingsCategory"
      },
      "chatJidIndex": null,
      "indexParts": [
        {
          "type": "literal",
          "value": "biz_ai_settings_nudge"
        }
      ]
    },
    "BotWelcomeRequest": {
      "module": "WAWebBotWelcomeRequestSync",
      "name": "bot_welcome_request",
      "collection": "regular_low",
      "version": 2,
      "scope": "chat",
      "baseClass": "ChatSyncdActionBase",
      "valueField": "botWelcomeRequestAction",
      "valueProtoType": "SyncActionValue.BotWelcomeRequestAction",
      "valueEnumFields": null,
      "chatJidIndex": 1,
      "indexParts": [
        {
          "type": "literal",
          "value": "bot_welcome_request"
        },
        {
          "type": "jid",
          "name": "chatJid"
        }
      ]
    },
    "BusinessBroadcastCampaign": {
      "module": "WAWebBroadcastCampaignSync",
      "name": "business_broadcast_campaign",
      "collection": "regular",
      "version": 1,
      "scope": "account",
      "baseClass": "AccountSyncdActionBase",
      "valueField": "businessBroadcastCampaignAction",
      "valueProtoType": "SyncActionValue.BusinessBroadcastCampaignAction",
      "valueEnumFields": {
        "bbProStatus": "BusinessBroadcastCampaignBBProStatus",
        "status": "BusinessBroadcastCampaignStatus"
      },
      "chatJidIndex": null,
      "indexParts": [
        {
          "type": "literal",
          "value": "business_broadcast_campaign"
        },
        {
          "type": "string",
          "name": "campaign"
        }
      ]
    },
    "BusinessBroadcastInsights": {
      "module": "WAWebBusinessBroadcastInsightsSync",
      "name": "business_broadcast_insights_sync",
      "collection": "regular",
      "version": 1,
      "scope": "account",
      "baseClass": "AccountSyncdActionBase",
      "valueField": "businessBroadcastInsightsAction",
      "valueProtoType": "SyncActionValue.BusinessBroadcastInsightsAction",
      "valueEnumFields": null,
      "chatJidIndex": null,
      "indexParts": [
        {
          "type": "literal",
          "value": "business_broadcast_insights_sync"
        },
        {
          "type": "string",
          "name": "campaignId"
        }
      ]
    },
    "BusinessBroadcastList": {
      "module": "WAWebBroadcastListSync",
      "name": "business_broadcast_list",
      "collection": "regular",
      "version": 1,
      "scope": "account",
      "baseClass": "AccountSyncdActionBase",
      "valueField": "businessBroadcastListAction",
      "valueProtoType": "SyncActionValue.BusinessBroadcastListAction",
      "valueEnumFields": null,
      "chatJidIndex": null,
      "indexParts": [
        {
          "type": "literal",
          "value": "business_broadcast_list"
        },
        {
          "type": "string",
          "name": "id"
        }
      ]
    },
    "CallLog": {
      "module": "WAWebCallLogSync",
      "name": "call_log",
      "collection": "regular",
      "version": 1,
      "scope": "account",
      "baseClass": "AccountSyncdActionBase",
      "valueField": "callLogAction",
      "valueProtoType": "SyncActionValue.CallLogAction",
      "valueEnumFields": {
        "callLogRecord.callResult": "CallLogRecord.CallResult",
        "callLogRecord.callType": "CallLogRecord.CallType",
        "callLogRecord.participants.callResult": "CallLogRecord.CallResult",
        "callLogRecord.silenceReason": "CallLogRecord.SilenceReason"
      },
      "chatJidIndex": null,
      "indexParts": [
        {
          "type": "literal",
          "value": "call_log"
        }
      ]
    },
    "ChatAssignment": {
      "module": "WAWebChatAssignmentSync",
      "name": "agentChatAssignment",
      "collection": "regular",
      "version": 7,
      "scope": "chat",
      "baseClass": "ChatSyncdActionBase",
      "valueField": "chatAssignment",
      "valueProtoType": "SyncActionValue.ChatAssignmentAction",
      "valueEnumFields": null,
      "chatJidIndex": 1,
      "indexParts": [
        {
          "type": "literal",
          "value": "agentChatAssignment"
        },
        {
          "type": "jid",
          "name": "chatJid"
        }
      ]
    },
    "ChatAssignmentOpenedStatus": {
      "module": "WAWebChatAssignmentOpenedStatusSync",
      "name": "agentChatAssignmentOpenedStatus",
      "collection": "regular",
      "version": 7,
      "scope": "chat",
      "baseClass": "ChatSyncdActionBase",
      "valueField": "chatAssignmentOpenedStatus",
      "valueProtoType": "SyncActionValue.ChatAssignmentOpenedStatusAction",
      "valueEnumFields": null,
      "chatJidIndex": 1,